op;codEntrada;codSaida;descricao;cliente;beneficiamento;setor;pesoUnitario;unidade;valorUnitario
5012;57200579;57200579;DOBRADICA MOVEL LE ESTAMPADA 363;IOCHPE MAXION S/A;ZN INCOLOR TRIVALENTE - EA1;ESTACIONARIO I;0,289;PC;1,2
5013;57200578;57200578;DOBRADICA MOVEL LD ESTAMPADA 363;IOCHPE MAXION S/A;ZN INCOLOR TRIVALENTE - EA1;ESTACIONARIO I;0,287;PC;0
5014;715086;87774A0;POSXFL DE TQ AC C6 M8X1,25 CHV12 H=8;CISER FIXADORES AUTOMOTIVOS SA;ZN INCOLOR TRIVALENTE - RA1;ROTATIVO I;0,0056;KG;2,16
5015;PF0P47044-TSU2;SER000281;M6-1.0X14 SEXT COLAR TRV 88;ACUMENT BRASIL SISTEMAS DE FIXAÇÃO LTDA;SELANTE - RA1;ROTATIVO I;6;KG;10,82
5016;67126054;67126054;HASTE  PINO E OLHAL SOLDADO;IOCHPE MAXION S/A;ZN INCOLOR TRIVALENTE + SELANTE - EA1;ESTACIONARIO I;1,63;PC;0
5017;PF0P43507-TSU1;SER000281;M4-0,7X6(6G)PAN PHS48;ACUMENT BRASIL SISTEMAS DE FIXAÇÃO LTDA;ZN IRIDESCENTE TRIVALENTE - RA1;ROTATIVO I;1,4;KG;3,51
5019;V4044410S;V4044410S;BUCHA CHASSI - 521 PT51_52 (CRIMPADA) S/REF;DN AUTOMOTIVOS BRASIL LTDA;ZN IRIDESCENTE TRIVALENTE - EA2;ESTACIONARIO I;0,57;PC;0
5020;PF0P36129-TSU1;SER000281;M6-1.00X5.0 PORCA SEXT CL8;ACUMENT BRASIL SISTEMAS DE FIXAÇÃO LTDA;ZN IRIDESCENTE TRIVALENTE - RA1;ROTATIVO I;2,4;KG;6,05
5021;PF0P31269-TSU1;SER000281;M8-1.25(6H) PORCA CIL SOLDA 8 SD;ACUMENT BRASIL SISTEMAS DE FIXAÇÃO LTDA;ZN INCOLOR TRIVALENTE - RA1;ROTATIVO I;5;KG;11,26
5022;25183440;25183440;SUPORTE FIXACAO DO RADIADOR LD;IOCHPE MAXION S/A;DECAPAR/OLEAR - FOSFATO;RM - DECAPAR;0,429;PC;2,15
5023;57301306;57301306;SUPORTE FIXACAO MACACO;IOCHPE MAXION S/A;ZN INCOLOR TRIVALENTE - EA1;ESTACIONARIO I;0,134;PC;2,06
5024;AE020212004C;AE020212004C;FLOW GUIDE CONFORMADO 341 Ø38,1 (S);***AETHRA SISTEMAS AUTOMOTIVOS S.A;ESTANHO AÇO - RM;RM - DECAPAR;0,073;PC;1,01
5025;11060127;20040080;PINO DO BATENTE PALIO MOD. 326 - 40306A;PROMA BRASIL AUTOMOTIVA;ZN IRIDESCENTE TRIVALENTE + DSH - RA1;ROTATIVO I;0,033;UN;0,31
5026;50;50;PORCA QUADRADA DE SOLDA M8;NUTEP SA INDUSTRIA METALURGICA;DECAPAR E OLEAR - RM;RM - DECAPAR;0,0072;KG;0
5027;198;198;PORCA SEXTAVADA C INSERTO DE NYLO;NUTEP SA INDUSTRIA METALURGICA;COMPLEMENTO ZN + PASS. IRIDESCENTE + SELANTE - RA1;ROTATIVO I;0,001;KG;0
5028;PF0P62659-TSU1;SER000281;9/16-18-UNF2AXI+3/8 SX DURLOK OX OL;ACUMENT BRASIL SISTEMAS DE FIXAÇÃO LTDA;OLEAR - RM;RM - DECAPAR;73,4;KG;27,84
5029;795823;1A00404000;"PI BT BR10-2 AC 5/16"" X 1"" ZB";CISER FIXADORES AUTOMOTIVOS SA;ZN INCOLOR TRIVALENTE + DSH + SELANTE - RA1;ROTATIVO I;0,0144;KG;3,01
5030;57301391;57200573;SUPORTE ESTAMPADO 46348911;IOCHPE MAXION S/A;ZN IRIDESCENTE TRIVALENTE - RA1;ROTATIVO I;0,065;PC;0,23
5031;20040035;20040035;OP20 ABA FIXA TRAS INF ESQUERDA;PROMA BRASIL AUTOMOTIVA LTDA;ZN INCOLOR TRIVALENTE - EA1;ESTACIONARIO I;0,191;UN;0,26
5033;PF0P36134-TSU1;SER000281;M10-1.50(6E)X13.0 PO SX FLANGE;ACUMENT BRASIL SISTEMAS DE FIXAÇÃO LTDA;DECAPAR E OLEAR - RM;RM - DECAPAR;22,7;KG;22,97
5034;0103.R87000000;0103.R87000000;"PORCA REDONDA DE FLANGE C/SOLDA 7/16""";NUTEP SA INDUSTRIA METALURGICA;DECAPAR E OLEAR - RM;RM - DECAPAR;0,0204;KG;0
5035;57301485;57200599;SUPORTE DA BATERIA ESTAMPADO;IOCHPE MAXION S/A;ZN IRIDESCENTE TRIVALENTE - EA1;ESTACIONARIO I;0,112;PC;0,72
5036;57200580;57200580;SUPORTE CENTRALINA 1.3 TRAT;IOCHPE MAXION S/A;ZN IRIDESCENTE TRIVALENTE - EA1;ESTACIONARIO I;0,39;PC;4,91
5037;57200581;57200581;SUPORTE CENTRALINA 1.0 TRAT;IOCHPE MAXION S/A;ZN IRIDESCENTE TRIVALENTE + SELANTE - EA2;ESTACIONARIO I;0,479;PC;0
5038;20040097;20040097;SEM DESCRIÇÃO;PROMA BRASIL AUTOMOTIVA LTDA;ZN INCOLOR TRIVALENTE - RA1;ROTATIVO I;0,103;UN;0
5039;31.950.086;31.950.086;5802995009 TUBULAÇAO RIGIDA REFRIGERACAO 0G35482734;EUROAR TECNOLOGIA AUTOMOTIVA LTDA.;ZN NIQUEL INCOLOR + SELANTE - RA2;ROTATIVO II;0,199;UN;0
5040;31.950.087;31.950.087;5803001290 TUBULAÇAO RIGIDA REFRIGERACAO 0G35482734;EUROAR TECNOLOGIA AUTOMOTIVA LTDA.;ZN NIQUEL INCOLOR + SELANTE - RA2;ROTATIVO II;0,199;UN;0
5041;31.950.088;31.950.088;580299180 TUBULAÇAO RIGIDA REFRIGERACAO 0G35482734;EUROAR TECNOLOGIA AUTOMOTIVA LTDA.;ZN NIQUEL INCOLOR + SELANTE - RA2;ROTATIVO II;0,199;UN;0
5042;PF0P36099-TSU1;SER000281;M12-1.25X11.0 BUJAO CONICA;ACUMENT BRASIL SISTEMAS DE FIXAÇÃO LTDA;ZN NIQUEL INCOLOR + SELANTE - RA2;ROTATIVO II;6,7;KG;41,4
5043;PF0P36100-TSU1;SER000281;M10-1.25X11.0 BUJAO CONICA;ACUMENT BRASIL SISTEMAS DE FIXAÇÃO LTDA;ZN NIQUEL INCOLOR + SELANTE - RA2;ROTATIVO II;4,5;KG;33,94
5044;0090.R05000000;0090.R05000000;PORCA QUADRADA DE SOLDA M5;NUTEP SA INDUSTRIA METALURGICA;DECAPAR E OLEAR - RM;RM - DECAPAR;0,0019;KG;0
5045;57301229;57200513;SEM DESCRIÇÃO;IOCHPE MAXION S/A;ESTANHO COBRE - RM;RM - ESTANHO;0,001;PC;0,05
5046;05.17.31AMOS;05.17.31AMOS;BRACKET - 6QE971858A;SODECIA MINAS GERAIS IND. DE COMP AUTOM LTDA;ZN NIQUEL PRETO + SELANTE - RA2;ROTATIVO II;0,1418;UN;0
5047;57301357;57200567;SUPORTE DIFERENCIAL MT;IOCHPE MAXION S/A;ZN IRIDESCENTE TRIVALENTE - EA1;ESTACIONARIO I;0,178;PC;0,52
5048;57301356;57200574;SUPORTE DIFERENCIAL MT;IOCHPE MAXION S/A;ZN IRIDESCENTE TRIVALENTE - EA1;ESTACIONARIO I;0,215;PC;0,51
5049;ACO234;ACO2344;SEM DESCRIÇÃO;ABB ELETRIFICACAO LTDA;ESTANHO AÇO - RM;RM - ESTANHO;0,056;KG;0
5050;ACO2344;ACO2344;SEM DESCRIÇÃO;ABB ELETRIFICACAO LTDA;ESTANHO AÇO - RM;RM - ESTANHO; -   ;KG;10,88
5051;PF0P47140-TSU1;SER000281;M4-0.70X14.0 PANELA TORX T20 8.8;ACUMENT BRASIL SISTEMAS DE FIXAÇÃO LTDA;FOSFATO DE ZINCO OLEADO;FOSFATO;2;KG;3
5052;57200449;57200449;CARCAÇA ZINCADA;IOCHPE MAXION S/A;ZN INCOLOR TRIVALENTE - EA1;ESTACIONARIO I;0,564;PC;0
5053;57301482;57200596;SUPORTE NONE;IOCHPE MAXION S/A;ZN NIQUEL INCOLOR + SELANTE - RA2;ROTATIVO II;0,046;PC;0,33
5054;QUI000073;QUI000073;SEM DESCRIÇÃO;ACUMENT BRASIL SISTEMAS DE FIXAÇÃO LTDA;AGUARDANDO TRATAMENTO;; -   ;L;0
5055;50045491311;50045491311;PORCA 0,016 M6X1 SEXTAVADO;IOCHPE MAXION S/A;ZN IRIDESCENTE TRIVALENTE - RA1;ROTATIVO I;0,012;PC;0,06
5056;PF0P64368-TSU1;SER000281;M10-1.25(6G) SX 8.8;ACUMENT BRASIL SISTEMAS DE FIXAÇÃO LTDA;ZN IRIDESCENTE TRIVALENTE - RA1;ROTATIVO I;24,6;KG;49,03
5057;PF0P47058-TSU1;SER000281;1/4-28UNF-2AX30.8 SEXT;ACUMENT BRASIL SISTEMAS DE FIXAÇÃO LTDA;OLEAR - RM;RM - DECAPAR;9,1;KG;5,26
5058;30080007E;30080007Z;RINFOZO SCONTRINO PORTELLONE;FAPE LTDA;ZN INCOLOR TRIVALENTE - EA1;ESTACIONARIO I;0,196;PC;0,85
5060;PF0P43837-TSU1;SER000281;ST 4.2-1.4X19 C LT TORX COLAR;ACUMENT BRASIL SISTEMAS DE FIXAÇÃO LTDA;ZN NIQUEL PRETO + DSH + SELANTE + OLEO - RA2;ROTATIVO II;2;KG;21,08
5061;57200571;57200571;BATENTE DO BANCO LE;IOCHPE MAXION S/A;ZN PRETO TRIVALENTE + SELANTE - EA1;ESTACIONARIO I;0,26;PC;0
5062;57200510;57200510;SUPORTE PDC;IOCHPE MAXION S/A;ZN IRIDESCENTE TRIVALENTE - EA1;ESTACIONARIO I;0,114;PC;0
5063;57210006;57210006;GAIOLA DO TIRANTE  PARAFUSO LE;IOCHPE MAXION S/A;ZN INCOLOR TRIVALENTE + SELANTE - RA1;ROTATIVO I;0,074;PC;0
5064;57210653;57200592;SUPORTE CENTRAL UREIA;IOCHPE MAXION S/A;ZN NIQUEL INCOLOR + SELANTE - RA2;ROTATIVO II;0,436;PC;5,38
5065;57301156;57301156;SEM DESCRIÇÃO;IOCHPE MAXION S/A;DECAPAR/OLEAR - FOSFATO;FOSFATO;0,2;PC;1,25
5066;999009;999009;GENERICO ITEM 641002 & 711001;USIMETAL INDUSTRIAL LTDA.;ZN NIQUEL INCOLOR + SELANTE - RA2;ROTATIVO II;0,003;UN;0,02
5070;57204227;57200575;LEVA COMANDO PINO ESFERICO REBITADO;IOCHPE MAXION S/A;ZN NIQUEL PRETO + SELANTE - RA2;ROTATIVO II;0,067;PC;1,48
5071;6685;6685;SEM DESCRIÇÃO;UNIACO LTDA;ZINCO PRETO TRIVALENTE + DSH - RA1;ROTATIVO II;0,0112;UN;0
5072;3197020013;3197020013;ARRUELA CTRAT ZINCO PRETO 1159-69 0651159000;CICLOPE COMPONENTES AUTOMOTIVOS LTDA;ZN PRETO TRIVALENTE + SELANTE - EA1;ESTACIONARIO I;0,074;PC;0,37
5073;57301409;57301409;SUPORTE REFORCO ESTAMPADO;IOCHPE MAXION S/A;ZN IRIDESCENTE TRIVALENTE + SELANTE - RA1;ROTATIVO I;0,04;PC;0,62
5074;57301411;57301411;SUPORTE  ESTAMPADO A 960 622 0014;IOCHPE MAXION S/A;ZN IRIDESCENTE TRIVALENTE + SELANTE - RA1;ROTATIVO I;0,06;PC;0
5076;57301433;57301433;SUPORTE ESTAMPADO A960 636 2416;IOCHPE MAXION S/A;ZN IRIDESCENTE TRIVALENTE + SELANTE - RA1;ROTATIVO I;0,014;PC;0
5077;57301433;57301433;SUPORTE ESTAMPADO A9606520514;IOCHPE MAXION S/A;ZN IRIDESCENTE TRIVALENTE + SELANTE - RA1;ROTATIVO I;0,037;PC;0
5079;566B613P1;566B613P1;SEM DESCRIÇÃO;ABB ELETRIFICACAO LTDA;PRATEAGEM - RM;RM - PRATA;0,041;KG;9,5
5081;30;30;PORCA QUADRADA DE SOLDA C/GUIA M6;NUTEP SA INDUSTRIA METALURGICA;DECAPAR E OLEAR - RM;RM - DECAPAR;0,0032;KG;0
5082;52205160C;52205160;FILLER HEAD CONFORMADO 358 Ø39,8 (S);***AETHRA SISTEMAS AUTOMOTIVOS S.A;ESTANHO AÇO - RM;RM - ESTANHO;0,075;PC;1,01
5083;0042.R20000000;0042.R20000000;SEM DESCRIÇÃO;NUTEP SA INDUSTRIA METALURGICA;DECAPAR E OLEAR - RM;RM - DECAPAR;0,0162;KG;0
5084;30022930200;57200582;REFORCO FECHADURA CAPO+BORDIONE;IOCHPE MAXION S/A;ZN INCOLOR TRIVALENTE - EA1;ESTACIONARIO I;0,73;PC;6,48
5085;669018;669018;PARAF FIX CONJ;USIMETAL INDUSTRIAL LTDA.;ZN IRIDESCENTE TRIVALENTE - RA1;ROTATIVO I;0,036;UN;0
5086;57201783;57201783;SUPORTE MOTOR ESTAMPADO;IOCHPE MAXION S/A;DECAPAR/OLEAR - FOSFATO;FOSFATO;1,075;PC;2,89
5088;57201784;57201784;SEM DESCRIÇÃO;IOCHPE MAXION S/A;DECAPAR/OLEAR - FOSFATO;FOSFATO;0,341;PC;0,92
5089;0205.R54010000;0205.R54010000;PORCA QUADRADA DE SOLDA M14;NUTEP SA INDUSTRIA METALURGICA;DECAPAR E OLEAR - RM;RM - DECAPAR;0,0425;KG;1,13
5090;0207.R20000000;0207.R20000000;PORCA SEXTAVADA DE SOLDA C/GUIA M8;NUTEP SA INDUSTRIA METALURGICA;DECAPAR E OLEAR - RM;RM - DECAPAR;0,0091;KG;0
5091;57200537;57200537;CHAPA ZINCADA;IOCHPE MAXION S/A;ZN IRIDESCENTE TRIVALENTE - RA1;ROTATIVO I;0,008;PC;0,15
5092;0192.R20000000;0192.R20000000;PORCA REDONDA DE SODA;NUTEP SA INDUSTRIA METALURGICA;ZN SEM PASSIVAÇÃO - RA1;ROTATIVO I;0,0146;KG;2,84
5093;715461;97618A1;PA SD AC 8.8 M8X1,25X20,75 MPOINT ZB;CISER FIXADORES AUTOMOTIVOS SA;ZN INCOLOR TRIVALENTE - RA1;ROTATIVO I;0,0177;KG;1,67
5094;95900100;95900100;SEM DESCRIÇÃO;CISER FIXADORES AUTOMOTIVOS SA;SELANTE NANOMATE;ROTATIVO II; -   ;KG;0
5096;57200500;57200500;SUPORTE TRAT. SUPERF.;IOCHPE MAXION S/A;ZN IRIDESCENTE TRIVALENTE - RA1;ROTATIVO I;0,065;PC;0
5097;57200545;57200545;FLANGE ACO ESTAMPADO;IOCHPE MAXION S/A;ZN IRIDESCENTE TRIVALENTE - RA1;ROTATIVO I;0,1;PC;0
5098;57200567;57200567;SUPORTE DIFERENCIAL MT;IOCHPE MAXION S/A;ZN IRIDESCENTE TRIVALENTE - EA1;ESTACIONARIO I;0,178;PC;0
5099;57200574;57200574;SUPORTE DIFERENCIAL MT;IOCHPE MAXION S/A;ZN IRIDESCENTE TRIVALENTE - EA1;ESTACIONARIO I;0,215;PC;0
5100;52029377E;52029377;ANEL SUPERIOR ESTAMPADO S REVESTIMENTO;** AETHRA SISTEMAS AUTOMOTIVOS S.A.;ZN IRIDESCENTE TRIVALENTE - EA1;ESTACIONARIO I;0,246;PC;1,45
5103;57200543;57200543;FLANGE SUPERIOR AC CARAMELLA;IOCHPE MAXION S/A;ZN IRIDESCENTE TRIVALENTE - RA1;ROTATIVO I;0,09;PC;0
5104;57200573;57200573;SUPORTE  46348911 ZINCADO;IOCHPE MAXION S/A;ZN IRIDESCENTE TRIVALENTE - RA1;ROTATIVO I;0,065;PC;0
5105;30012500300;30012500300;SUPORTE VAO MOTOR TRATAMENTO SUP;IOCHPE MAXION S/A;ZN IRIDESCENTE TRIVALENTE - EA1;ESTACIONARIO I;0,11;PC;0
5107;1303634;1303634;PLACA FECHO CAPO UNO TRATAM;IOCHPE MAXION S/A;ZN IRIDESCENTE TRIVALENTE - EA1;ESTACIONARIO I; -   ;PC;0
5108;57200576;57200576;DOBRADIÇA FIXA LD ZINCADA;IOCHPE MAXION S/A;ZN IRIDESCENTE TRIVALENTE - EA1;ESTACIONARIO I;0,205;PC;0
5109;57210655;57200582;REFORCO FECHADURA CAPO+BORDIONE;IOCHPE MAXION S/A;ZN INCOLOR TRIVALENTE - EA1;ESTACIONARIO I;0,73;PC;6,48
5110;PF0P36136-TSU1;SER000281;BUCHA SOLDA OLEADO;ACUMENT BRASIL SISTEMAS DE FIXAÇÃO LTDA;DECAPAR E OLEAR - RM;RM - DECAPAR;29;KG;29,34
5111;0035.R11000000;0035.R11000000;PORCA QUADRADA DE SOLDA M6;NUTEP SA INDUSTRIA METALURGICA;DECAPAR E OLEAR - RM;RM - DECAPAR;0,003;KG;1,13
5114;57200572;57200572;BATENTE BANCO LD TRAT. SUPERFICIAL;IOCHPE MAXION S/A;ZN PRETO TRIVALENTE + SELANTE - EA1;ESTACIONARIO I;0,26;PC;0,89
5116;PF0P36135-TSU1;SER000281;BUCHA SOLDA OLEADO;ACUMENT BRASIL SISTEMAS DE FIXAÇÃO LTDA;DECAPAR E OLEAR - RM;RM - DECAPAR;2,4;KG;2,43
5117;PF0P36133-TSU1;SER000281;PORCA CILINDRICA OLEADO;ACUMENT BRASIL SISTEMAS DE FIXAÇÃO LTDA;DECAPAR E OLEAR - RM;RM - DECAPAR;6,4;KG;6,48
5120;67360182;67340182;ALAVANCA DE ACIONAMENTO ESTAMPADO LD;IOCHPE MAXION S/A;ZN IRIDESCENTE TRIVALENTE - RA1;ROTATIVO I;0,012;PC;0,1
5121;67360183;67340183;ALAVANCA DE ACIONAMENTO ESTAMPADO LE;IOCHPE MAXION S/A;ZN IRIDESCENTE TRIVALENTE - RA1;ROTATIVO I;0,012;PC;0,1
5122;0299.R87000000;0299.R87000000;PORCA SEXTAVADA FLANGE E SOLDA;NUTEP SA INDUSTRIA METALURGICA;DECAPAR E OLEAR - RM;RM - DECAPAR;0,035;KG;0
5123;0196.R21000000;0196.R21000000;PORCA SEXTAVADA DE FLANGE C/ SOLDA M8;NUTEP SA INDUSTRIA METALURGICA;DECAPAR E OLEAR - RM;RM - DECAPAR;0,012;KG;1,13
5126;57210676;57200470;TUBO DOBRADICA PORTA MALA LD;IOCHPE MAXION S/A;ZN INCOLOR TRIVALENTE - EA1;ESTACIONARIO I;1,293;PC;3,86
5127;67360144;67340144;ALAVANCA DE ALOJAMENTO ESTAMPADO LD;IOCHPE MAXION S/A;ZN IRIDESCENTE TRIVALENTE - RA1;ROTATIVO I;0,006;PC;0,05
5128;67360145;67340145;ALAVANCA DE ALOJAMENTO ESTAMPADO LE;IOCHPE MAXION S/A;ZN IRIDESCENTE TRIVALENTE - RA1;ROTATIVO I;0,006;PC;0,05
5129;0122.R31000000;0122.R31000000;PORCA QUADRADA DE SOLDA GUIA M10;NUTEP SA INDUSTRIA METALURGICA;OLEAR - RM;RM - DECAPAR;0,01;KG;0
5130;57210677;57200469;TUBO DOBRADICA PORTA MALA LE;IOCHPE MAXION S/A;ZN INCOLOR TRIVALENTE - EA1;ESTACIONARIO I;1,286;PC;3,86
5131;57201510;57201510;TRAVESSA SUPERIOR DOS FAROIS;IOCHPE MAXION S/A;ZN INCOLOR TRIVALENTE - EA1;ESTACIONARIO I;2,313;PC;26,49
5137;712;712;TERMINAL 04.047.AI94.001;USILIDER USINAGEM DE METAIS LTDA;ZN NIQUEL INCOLOR + SELANTE - RA2;ROTATIVO II;0,003;KG;0
5139;57200587;57200587;SUPORTE SUSTENTACAO MANICOTTI;IOCHPE MAXION S/A;ZN NIQUEL INCOLOR + SELANTE - RA2;ROTATIVO II;0,058;PC;0,36
5140;252B2639P1;252B2639P1F;PLACA METALICA P MONTAGEM EM DISJ. RE;ABB ELETRIFICACAO LTDA;ZN INCOLOR TRIVALENTE - RA1;ROTATIVO I;0,0886;KG;5,14
5141;793A504PB1;793A504PB1;MAGNETO;ABB ELETRIFICACAO LTDA;ZN IRIDESCENTE TRIVALENTE - RA1;ROTATIVO I;0,0014;PC;5,04
5142;V4045800C;V4045800C;SUPORTE ESTRUTURAL SUPERIOR (ZINCADO);DN AUTOMOTIVOS BRASIL LTDA;ZN IRIDESCENTE TRIVALENTE - EA1;ESTACIONARIO I;0,565;PC;0
5143;PFOP60123-TSU1;SER000281;M-10-1,50-6GX45 SX 10.9;ACUMENT BRASIL SISTEMAS DE FIXAÇÃO LTDA;FOSFATO DE ZINCO OLEADO;FOSFATO;33,4;KG;41,48
5144;0018.R87000000;0018.R87000000;"PORCA REDONDA DE SOLDA 7/16""";NUTEP SA INDUSTRIA METALURGICA;OLEAR - RM;RM - DECAPAR;0,022;KG;0
5145;0179.R10000000;0179.R10000000;PORCA SEXTAVADA DE SOLDA C/ GUIA M6;NUTEP SA INDUSTRIA METALURGICA;DECAPAR E OLEAR - RM;RM - DECAPAR;0,0048;KG;1,13
5146;0029.R10000000;0029.R10000000;PORCA REDONDA DE FLANGE C/ SOLDA M6;NUTEP SA INDUSTRIA METALURGICA;DECAPAR E OLEAR - RM;RM - DECAPAR;0,005;KG;1,13
5148;AE020212004P_EST;AE020212004P;FLOW GUIDE BOCAL 3410 ESTAMPADO;***AETHRA SISTEMAS AUTOMOTIVOS S.A;ESTANHO AÇO - RM;RM - ESTANHO;0,073;PC;1,01
5149;0237.R32000000;0237.R32000000;PORCA REDONDA DE SOLDA C GUIA M10;NUTEP SA INDUSTRIA METALURGICA;DECAPAR E OLEAR - RM;RM - DECAPAR;0,034;KG;1,13
5150;57200592;57200592;SUPORTE CENTRAL UREIA;IOCHPE MAXION S/A;ZN NIQUEL INCOLOR + SELANTE - RA2;ROTATIVO II;0,436;PC;0
5151;0086.R10000000;0086.R10000000;PORCA QUADRADA DE SOLDA C/ GUIA M6;NUTEP SA INDUSTRIA METALURGICA;DECAPAR E OLEAR - RM;RM - DECAPAR;0,0035;KG;1,13
5152;30011950200;30011950200;DOBRADIÇA FIXA LE ESTAMPADA;IOCHPE MAXION S/A;ZN IRIDESCENTE TRIVALENTE - EA1;RM - DECAPAR;0,205;PC;0
5153;139C5312P1F;139C5312P1F;LINE STRAP AQ BENEFICIADO;ABB ELETRIFICACAO LTDA;ESTANHO LATÃO - RM;ESTACIONARIO I;0,006;KG;7,77
5154;208C3599P1F;208C3599P1F;BLADE;ABB ELETRIFICACAO LTDA;ESTANHO LATÃO - RM;RM - ESTANHO;0,0381;KG;0
5155;569B580P1F;569B580P1;STAB;ABB ELETRIFICACAO LTDA;PRATEAGEM - RM;RM - ESTANHO;0,002;KG;9,29
5156;PF0P36137-TSU1;SER000281;M12-1.75(6H) PO SEXT SOLDA;ACUMENT BRASIL SISTEMAS DE FIXAÇÃO LTDA;DECAPAR E OLEAR - RM;RM - PRATA;34,5;KG;34,91
5157;52205160P_SD;52205160P;FLOW GUIDE BOCAL 358 SOLDADO;***AETHRA SISTEMAS AUTOMOTIVOS S.A;ESTANHO AÇO - RM;RM - ESTANHO;0,075;PC;1,01
5160;25491030;25491030;SUPORTE TERRA AS;IOCHPE MAXION S/A;DECAPAR/OLEAR - FOSFATO;FOSFATO;0,024;PC;0,42
5161;67156033;67156033;SEM DESCRIÇÃO;IOCHPE MAXION S/A;AGUARDANDO TRATAMENTO;;0,381;PC;0
5162;715605;97619A0;POSXDPAC G5 UNF 5/8;CISER FIXADORES AUTOMOTIVOS SA;ZN IRIDESCENTE TRIVALENTE - RA1;ROTATIVO I;0,0525;KG;2,49
5163;57200588;57200588;SUPORTE FIXACAO TUBO DO MOTOR;IOCHPE MAXION S/A;ZN NIQUEL INCOLOR + SELANTE - RA2;ROTATIVO II;0,027;PC;0
5164;57200569;57200569;SUPORTE ESTAMPADO AFM 363;IOCHPE MAXION S/A;ZN IRIDESCENTE TRIVALENTE - EA1;ESTACIONARIO I;0,565;PC;0
5165;57200570;57200570;SUPORTE SONDA LAMBDA;IOCHPE MAXION S/A;ZN IRIDESCENTE TRIVALENTE - EA1;ESTACIONARIO I;0,075;PC;0
5166;715395;1A00302200;COLAR MBTCH- BR12 AC MAG(CO);CISER FIXADORES AUTOMOTIVOS SA;ZN INCOLOR TRIVALENTE - RA1;ROTATIVO I;0,033;KG;2,22
5168;57200450;57200450;CONJ. CARCACA SOLDADO;IOCHPE MAXION S/A;ZN INCOLOR TRIVALENTE - EA1;ESTACIONARIO I;0,589;PC;0
5169;0060.R31010000;0060.R31010000;PORCA QUADRADA  DE SOLDA M10X15;NUTEP SA INDUSTRIA METALURGICA;DECAPAR E OLEAR - RM;RM - DECAPAR;0,012;KG;1,13
5170;PF0P31061-TSU1;SER000281;M6X1.0(6H) PORCA SEXT FL;ACUMENT BRASIL SISTEMAS DE FIXAÇÃO LTDA;ZN IRIDESCENTE TRIVALENTE - RA1;ROTATIVO I;4,2;KG;9,67
5171;57200454;57200572;BATENTE DO BANCO LD REBITADO 363;IOCHPE MAXION S/A;ZN PRETO TRIVALENTE + SELANTE - EA1;ESTACIONARIO I;0,26;PC;0,89
5172;17.3;17.3;TUBOS DE GAS 180MM;ATILLA TORRADORES INTELIGENTES LTDA;ZN NIQUEL PRETO + SELANTE - RA2;ROTATIVO II; -   ;KG;0
5174;0248.R06010000;0248.R06010000;PORCA QUADRADA DE SOLDA M5;NUTEP SA INDUSTRIA METALURGICA;DECAPAR E OLEAR - RM;RM - DECAPAR;0,0017;KG;1,13
5175;PF0P60126-TSU1;SER000281;M10-1,50-6GX45 SX;ACUMENT BRASIL SISTEMAS DE FIXAÇÃO LTDA;ZN INCOLOR TRIVALENTE + DSH - RA1;ROTATIVO I;34,7;KG;98,43
5176;AE020206010C;AE020206010C;FLOW GUIDE CONFORMADO 265 38,1;***AETHRA SISTEMAS AUTOMOTIVOS S.A;ESTANHO AÇO - RM;RM - ESTANHO;0,037;PC;0,77
5177;AE020206010P_EST;AE020206010P;FLOW GUIDE CONFORMADO 2650;***AETHRA SISTEMAS AUTOMOTIVOS S.A;ESTANHO AÇO - RM;RM - ESTANHO;0,037;PC;0,77
5178;0327.R31010000;0327.R31010000;PORCA SEXTAVADA DE FLANGE E SOLDA M10;NUTEP SA INDUSTRIA METALURGICA;DECAPAR E OLEAR - RM;RM - DECAPAR;0,022;KG;1,13
5179;25183328;25183328;BATENTE ANTERIOR PORTA ANTERIOR;IOCHPE MAXION S/A;ZN INCOLOR TRIVALENTE - EA1;ESTACIONARIO I;0,028;PC;0,38
5180;25183330;25183330;BATENTE POSTERIOR PORTA ANTERIOR;IOCHPE MAXION S/A;ZN INCOLOR TRIVALENTE - EA1;ESTACIONARIO I;0,028;PC;0,38
5181;30010050300;30010050300;SUPORTE DIFERENCIAL MT;IOCHPE MAXION S/A;ZN IRIDESCENTE TRIVALENTE - EA1;ESTACIONARIO I;0,178;PC;0
5182;0222.S20010000;0222.S20010000;PORCA SEXTAVADA DE FLANGE 8E;NUTEP SA INDUSTRIA METALURGICA;DECAPAR E OLEAR - RM;RM - DECAPAR;0,008;KG;1,13
5183;715761;97621A1;PAS 4PJES AC 8.8 M8X1,25X25 RI DEOL(CO);CISER FIXADORES AUTOMOTIVOS SA;DECAPAR E OLEAR - RM;RM - DECAPAR;0,013;KG;0,86
5184;0165.R11003500;0165.R11003500;PORCA QUADRADA DE SOLDA M6;NUTEP SA INDUSTRIA METALURGICA;DECAPAR E OLEAR - RM;RM - DECAPAR;0,003;KG;1,13
5185;57200499;57200499;SUPORTE;IOCHPE MAXION S/A;ZN IRIDESCENTE TRIVALENTE - RA1;ROTATIVO I;0,157;PC;0
5186;0234.R10000000;0234.R10000000;PORCA SEXTAVADA DE FLANGE M6;NUTEP SA INDUSTRIA METALURGICA;DECAPAR E OLEAR - RM;RM - DECAPAR;0,014;KG;1,13
5187;715615;87911A0;PO SX FL DE AC M5X0,8 CH;CISER FIXADORES AUTOMOTIVOS SA;ZINCO PRETO TRIVALENTE + SELANTE - RA1;ROTATIVO I;0,002;KG;5,56
5190;715697;97620 A1;PA SD AC 8.8 M6X1X23;CISER FIXADORES AUTOMOTIVOS SA;DECAPAR E OLEAR - RM;RM - DECAPAR;0,011;KG;1,05
5191;57200508;57200508;SUPORTE TETO ROSQUEADO;IOCHPE MAXION S/A;ZN IRIDESCENTE TRIVALENTE - RA1;ROTATIVO I;0,02;PC;0
5192;AE020201050CS;52223412;GUIA DE FLUXO SOLDADO;***AETHRA SISTEMAS AUTOMOTIVOS S.A;ESTANHO AÇO - RM;RM - ESTANHO;0,055;PC;1,01
5193;0351.R20010000;0351.R20010000;PORCA REDONDA DE SOLDA C/ GUIA M8;NUTEP SA INDUSTRIA METALURGICA;DECAPAR E OLEAR - RM;RM - DECAPAR;0,015;KG;1,13
5194;0349.R21010000;0349.R21010000;PORCA REDONDA DE SOLDA M8;NUTEP SA INDUSTRIA METALURGICA;ZN INCOLOR TRIVALENTE - RA1;ROTATIVO I;0,013;KG;3,03
5195;PF0P36139-TSU1;SER000281;M8-1.25 PORCA CIL SOLDA 8 SD;ACUMENT BRASIL SISTEMAS DE FIXAÇÃO LTDA;DECAPAR E OLEAR - RM;RM - DECAPAR;13,2;KG;13,37
5196;57210005;57200062;DOBRADIÇA FIXA OLHAL LD 178;IOCHPE MAXION S/A;ZN INCOLOR TRIVALENTE - RA1;ROTATIVO I;0,236;PC;0,73
5197;PF0P31113-TSU1;SER000281;M6X1.0-6H SEXT FL = P31103;ACUMENT BRASIL SISTEMAS DE FIXAÇÃO LTDA;ZN INCOLOR TRIVALENTE + SELANTE - RA1;ROTATIVO I;3,2;KG;12
5198;0124.R20000000;0124.R20000000;PORCA SEXTAVADA M8;NUTEP SA INDUSTRIA METALURGICA;DECAPAR E OLEAR - RM;RM - DECAPAR;0,013;KG;1,13
5199;0112.R87003500;0112.R87003500;PORCA QUADRADA DE SOLDA 7/16;NUTEP SA INDUSTRIA METALURGICA;DECAPAR E OLEAR - RM;RM - DECAPAR;0,018;KG;1,13
5200;0255.R05000000;0255.R05000000;PORCA SEXTAVADA DE SOLDA M5;NUTEP SA INDUSTRIA METALURGICA;ZN SEM PASSIVAÇÃO - RA1;ROTATIVO I;0,0045;KG;2,84
5201;208C3560P3;208C3560P3;MAGNETO 35-60A;ABB ELETRIFICACAO LTDA;ZN INCOLOR TRIVALENTE - RA1;ROTATIVO I;0,0029;PC;4,92
5202;PF0P36122-TSU1;SER000281;M12-1,75(6H)PO SEXT FLANGE R10;ACUMENT BRASIL SISTEMAS DE FIXAÇÃO LTDA;ZN IRIDESCENTE TRIVALENTE - RA1;ROTATIVO I;23,5;KG;68,2
5204;716102;97624A0;POSXSD M5X0,8-6H CHV13;CISER FIXADORES AUTOMOTIVOS SA;ZN SEM PASSIVAÇÃO - RA1;ROTATIVO I;0,0046;KG;2,66
5205;PF0P14831-TSU1;SER000281;M12-1,5X26 SOLDA (6G);ACUMENT BRASIL SISTEMAS DE FIXAÇÃO LTDA;DECAPAR E OLEAR - RM;RM - DECAPAR;35;KG;31,82
5208;0196.R21000000;0196.R21003500;PORCA SEXTAVADA DE FALNGE M8;NUTEP SA INDUSTRIA METALURGICA;ZN INCOLOR TRIVALENTE - RA1;ROTATIVO I;0,011;KG;3,03
5209;PF0P36124-TSU1;SER000281;M14-2,00(6H) POSEXT FLANGE;ACUMENT BRASIL SISTEMAS DE FIXAÇÃO LTDA;ZN IRIDESCENTE TRIVALENTE - RA1;ROTATIVO I;31;KG;101,58
5212;PF0P11430-TSU1;SER000281;BUCHA 28,0X18,0X72,0;ACUMENT BRASIL SISTEMAS DE FIXAÇÃO LTDA;DECAPAR E OLEAR - RM;RM - DECAPAR;204,3;KG;206,98
5213;0246.R10000000;0246.R10000000;PORCA SEXTAVADA SOLDA M6;NUTEP SA INDUSTRIA METALURGICA;DECAPAR E OLEAR - RM;RM - DECAPAR;0,0054;KG;1,13
5215;AE40066049;22895934;CONJUNTO SUPORTE COM GANCHO;FLAMMA AUTOMOTIVA SA;ZN INCOLOR TRIVALENTE - RA1;ROTATIVO I;0,129;PC;0,6
5218;10055226P1;10055226P1B;TERMINAL EM COBRE;ABB ELETRIFICACAO LTDA;ESTANHO COBRE - RM;RM - DECAPAR;0,023;KG;7,77
5221;0099.R30000000;0099.R30000000;PORCA QUADRADA DE SOLDA M10;NUTEP SA INDUSTRIA METALURGICA;DECAPAR E OLEAR - RM;RM - DECAPAR;0,013;KG;1,13
5222;0166.R63000000;0166.R63000000;PORCA SEXTAVADA DE SOLDA M16;NUTEP SA INDUSTRIA METALURGICA;DECAPAR E OLEAR - RM;RM - DECAPAR;0,061;KG;1,13
5223;0099.R36000000;0099.R36000000;PORCA QUADRADA DE SOLDA M10;NUTEP SA INDUSTRIA METALURGICA;DECAPAR E OLEAR - RM;RM - DECAPAR;0,012;KG;1,13
5224;PF0P21237-TSU1;SER000281;M18-1,5X13,0 BUJAO CONICA;ACUMENT BRASIL SISTEMAS DE FIXAÇÃO LTDA;ZN IRIDESCENTE TRIVALENTE - RA1;ROTATIVO I;14,3;KG;58,06
5225;57200234;57200234;REFORCO DOBRADICA MOVEL FLP SOLDADO LD;IOCHPE MAXION S/A;ZN IRIDESCENTE TRIVALENTE - RA1;ROTATIVO I;0,202;PC;0
5226;0194.R42000000;0194.R42000000;PORCA SEXTAVADA M12;NUTEP SA INDUSTRIA METALURGICA;ZN INCOLOR TRIVALENTE - RA1;ROTATIVO I;0,015;KG;3,03
5228;57200586;57200586;SUPORTE VAO MOTOR TRATADO;IOCHPE MAXION S/A;ZN IRIDESCENTE TRIVALENTE - EA1;ESTACIONARIO I;0,11;PC;0
5229;57200591;57200591;SUPORTE CABO DE VELAS ESTAMPADO;IOCHPE MAXION S/A;ZN IRIDESCENTE TRIVALENTE - RA1;ROTATIVO I;0,089;PC;1
5230;50048463311;50424673310;TUBO DOBRADICA LD;IOCHPE MAXION S/A;ZN INCOLOR TRIVALENTE - EA1;ESTACIONARIO I;1,261;PC;3,86
5231;50048703311;50424663310;TUBO DOBRADICA LE;IOCHPE MAXION S/A;ZN INCOLOR TRIVALENTE - EA1;ESTACIONARIO I;1,261;PC;3,86
5232;50045271314;50437401332;PINO 16X69,45 8.8;IOCHPE MAXION S/A;ZN INCOLOR TRIVALENTE - RA1;ROTATIVO I;0,063;PC;0,17
5233;50040902915;50437391332;PINI ESFERICO MAIOR 8,8 8X59,8;IOCHPE MAXION S/A;ZN INCOLOR TRIVALENTE - RA1;ROTATIVO I;0,0248;PC;0,4
5235;519466871;519466871Z;PIASTRA SUPORTO TAMP. SOSP. DX;NEO STEEL S.A;ZN IRIDESCENTE TRIVALENTE - EA1;ESTACIONARIO I;1,323;PC;4,28
5236;519466881;519466881Z;SEM DESCRIÇÃO;NEO STEEL S.A;ZN IRIDESCENTE TRIVALENTE - EA1;ESTACIONARIO I;1,323;PC;4,28
5240;716179;97623A1;PA SD AC 8.8 M6X1X28 MPOINT DEOL;CISER FIXADORES AUTOMOTIVOS SA;DECAPAR E OLEAR - RM;RM - DECAPAR;0,012;KG;1,21
5241;2004010002;2004010002;SEM DESCRIÇÃO;CICLOPE COMPONENTES AUTOMOTIVOS LTDA;ZN INCOLOR TRIVALENTE - EA1;ESTACIONARIO I;0,496;PC;0
5242;57301365;57301365;EXTENSAO ENTRADA DE AR ESTAMP;IOCHPE MAXION S/A;DECAPAR E OLEAR - RM;RM - DECAPAR;0,113;PC;0
5243;0255.R5003500;0255.R5003500;PORCA SEXTAVADA DE SOLDA C/GUIA M;NUTEP SA INDUSTRIA METALURGICA;DECAPAR E OLEAR - RM;RM - DECAPAR;0,006;KG;1,13
5245;5070306;57200006;TIRANTE M64X3,0X1070;USINAGEM CASTRO LTDA;FOSFATO DE ZINCO OLEADO;FOSFATO;26,5;PC;87,5
5246;57200502;57200502;REFORCO TETO ESTAMPADO;IOCHPE MAXION S/A;ZN IRIDESCENTE TRIVALENTE - RA1;ROTATIVO I;0,035;PC;0
5255;PF0P36020-TSU1;SER000281;M6X1,0-6H PORCA CILINDRICA;ACUMENT BRASIL SISTEMAS DE FIXAÇÃO LTDA;DECAPAR E OLEAR - RM;RM - DECAPAR;7;KG;8,05
5256;57200501;57200501;REFORCO DO TETO;IOCHPE MAXION S/A;ZN IRIDESCENTE TRIVALENTE - RA1;ROTATIVO I;0,018;PC;0
5257;0107.R21003500;0107.R21003500;PORCA SEXTAVADA M8;NUTEP SA INDUSTRIA METALURGICA;DECAPAR E OLEAR - RM;RM - DECAPAR;0,009;KG;1,13
5258;0139.R20000000;0139.R20000000;PORCA SEXTAVADA M8;NUTEP SA INDUSTRIA METALURGICA;DECAPAR E OLEAR - RM;RM - DECAPAR;0,007;KG;1,13
5259;52209587E;52209587;FLOW GUIDE 265 ESTAMPADO;* AETHRA SISTEMAS AUTOMOTIVOS S.A.;ESTANHO AÇO - RM;RM - ESTANHO;0,038;PC;0,77
5260;749004;749004;PINO ESFERICO (USM-179);USIMETAL INDUSTRIAL LTDA.;ZN NIQUEL INCOLOR + SELANTE - RA2;ROTATIVO II;0,0175;UN;0,13
5261;PF0P47145-TSU1;SER000281;M5-0,8X16 BOTÃO TORX 58;ACUMENT BRASIL SISTEMAS DE FIXAÇÃO LTDA;ZN FERRO PRETO + SELANTE - RA2;ROTATIVO II;5,6;KG;45,42
5262;PF0P66733-TSU1;SER000281;M12-175X40,0 SEXTAVADO 88;ACUMENT BRASIL SISTEMAS DE FIXAÇÃO LTDA;ZN FERRO PRETO + SELANTE - RA2;ROTATIVO II;45,1;KG;151,27
